komentar,timestamp,platform,sentimen,clean
Seminggu ini saldo danaku udah 2x ke sedot google tapi bukan masalah langganan,1 tahun yang lalu,youtube,netral,seminggu saldo danaku udah x sedot google tapi bukan masalah langganan
​ @Ak-uz6yq terus gmn KA..dibalikin ga,6 bulan yang lalu,youtube,netral,​ uzyq terus gmn kadibalikin ga
Dana ku d hack orang,1 tahun yang lalu,youtube,negatif,dana ku d hack orang
dana lagi ga beres 2 minggu kebelakang saya juga hilang uang dan akun nya tiba2 di ambil alih sama orang lain pedahal ga dapet info kode otp atau yang lainnya,11 bulan yang lalu,youtube,negatif,dana lagi ga beres minggu kebelakang hilang uang akun nya tiba ambil alih sama orang lain pedahal ga dapet info kode otp lainnya
"​ @febridialugina4173 Jangn klik link apapun di luar dana pastinya aman, alhmdulillah uang jutaan di dana aman, sempat dapat tlfon dari nomer gk dikenal,  saya gk angkat, tiba tiba dana ku gl bisa di bukak, habis itu nomernya saya blok, dana saya diamkan sehari, alhamdulillah bisa di bukak lagi, SALDONYA masih aman",8 bulan yang lalu,youtube,positif,​ jangn klik link apapun luar dana pastinya aman alhmdulillah uang jutaan dana aman sempat dapat tlfon nomer gk dikenal gk angkat tiba tiba dana ku gl bisa bukak habis nomernya blok dana diamkan sehari alhamdulillah bisa bukak lagi saldonya masih aman
Sama saya 2juta hilang beserta akunnya tidak bisa login.lapor cs jawabqn zonk.,11 bulan yang lalu,youtube,negatif,sama juta hilang beserta akunnya tidak bisa loginlapor cs jawabqn zonk
Sama uangku jga ilang d dana😢,10 bulan yang lalu,youtube,netral,sama uangku jga ilang d dana😢
Saya 1.5 di dana ilang,4 bulan yang lalu,youtube,netral,dana ilang
"Sama saya juga baru saja saldo hilang 200 rb, awalnya ada pengajuan pinjaman 4 juta, pdhal saya tidak pernah mengajukan pinjaman ke dana dan saya juga tidak punya tagihan di Dana, sama cs dana nya udh di wa jika bukan anda silahkan mengajukan pembatalan dengan kode otp yg diberikan sma Dana, tpi pendingnya lama bngt smpe akhirnya saya riset dan minta kode yg baru tpi gk dikirim² akhirnya saldo 200 hilang dan yang tagihan 4 juta gagal, saya udh curiga ini ulah dari sananya jdi takut klo mau top up lgi takutnya lngsung ilang.... 

Akhirnya saya memutuskan untuk uninstall Dana😊",4 bulan yang lalu (diedit),youtube,negatif,sama baru saja saldo hilang rb awalnya ada pengajuan pinjaman juta pdhal tidak pernah mengajukan pinjaman dana tidak punya tagihan dana sama cs dana nya udh wa jika bukan anda silahkan mengajukan pembatalan kode otp yg diberikan sma dana tpi pendingnya lama bngt smpe akhirnya riset minta kode yg baru tpi gk dikirim² akhirnya saldo hilang tagihan juta gagal udh curiga ulah sananya jdi takut klo mau top up lgi takutnya lngsung ilang akhirnya memutuskan uninstall dana😊
Makanya saya juga  gak berani nyimpan terlalu banyak .. 😢,2 minggu yang lalu,youtube,netral,makanya gak berani nyimpan terlalu banyak 😢
Gwa ilang 500 ribu bang di dana,1 tahun yang lalu,youtube,netral,gwa ilang ribu bang dana
 @ridoalmsyh  nah makanya suka parno  kalo nyimpen jutaan di dana,1 tahun yang lalu,youtube,netral,nah makanya suka parno kalo nyimpen jutaan dana
​ @ridoalmsyh gue juga barusan 400 bang..entah dibalikin at nggak😢,6 bulan yang lalu,youtube,netral,​ gue barusan bangentah dibalikin at nggak😢
Hilang apa di pake maen slot😅😅​ @ridoalmsyh ,1 tahun yang lalu,youtube,negatif,hilang apa pake maen slot😅😅​
40 JT. Tapi hati² soalnya banyak saldo yang hilang dan gak kembali,1 tahun yang lalu,youtube,negatif,jt tapi hati² soalnya banyak saldo hilang gak kembali
ayahnya kaya,1 tahun yang lalu,youtube,netral,ayahnya kaya
BCA terbaik 1 di Indonesia dan  otomatis the best perwakilan di dunia dari Indonesia karena orang2 elite semuanya berkumpul dalam keluarga BCA,10 bulan yang lalu,youtube,netral,bca terbaik indonesia otomatis the best perwakilan dunia indonesia orang elite semuanya berkumpul dalam keluarga bca
Yg aman dan jangka panjang tabunglah uang anda di bank milik pemerintah BTN BNI  BRI,1 tahun yang lalu,youtube,positif,yg aman jangka panjang tabunglah uang anda bank milik pemerintah btn bni bri
​ @asriyani3109  BCA gak aman kah?,1 tahun yang lalu,youtube,netral,​ bca gak aman kah
Ovo ato gopay sih,1 tahun yang lalu,youtube,netral,ovo ato gopay sih
coba flip bang.,1 tahun yang lalu,youtube,netral,coba flip bang
semangat kak semoga segera terisi sampe luber..,1 tahun yang lalu,youtube,netral,semangat kak semoga segera terisi sampe luber
"​ @situsgadget saya sudah daftar semua e wallet sampai komplit
Mau cari yg beneran aman dan nyaman",1 tahun yang lalu,youtube,positif,​ sudah daftar semua e wallet sampai komplit mau cari yg beneran aman nyaman
Flip itu lebih tepatnya aplikasi transfer antar bank dengan biaya gratis. Bisa juga dipakai untuk top up e wallet tanpa biaya admin.,1 tahun yang lalu,youtube,positif,flip lebih tepatnya aplikasi transfer antar bank biaya gratis bisa dipakai top up e wallet tanpa biaya admin
Pakai yg kita paham aja kak .biar mudah,1 tahun yang lalu,youtube,positif,pakai yg kita paham aja kak biar mudah
"Aku udah dr 2020 pake flip, dan aman. Mudah buat dapet gratis TF antar bank dan ngisi ewallet",1 bulan yang lalu,youtube,positif,udah dr pake flip aman mudah buat dapet gratis tf antar bank ngisi ewallet
Dana banyak hack nya 😢,1 tahun yang lalu,youtube,negatif,dana banyak hack nya 😢
one of the best 👌,1 tahun yang lalu,youtube,netral,one of the best 👌
aman tapi saldo tiba2 lenyap padahal hp yg gak di apa2in,1 tahun yang lalu,youtube,positif,aman tapi saldo tiba lenyap padahal hp yg gak apain
"Sama kasus saya, 2juta hilang krn tiba2 tdk bisa login.dan melapor ke cs tapi penyelesainx zonk.",11 bulan yang lalu,youtube,negatif,sama kasus juta hilang krn tiba tdk bisa logindan melapor cs tapi penyelesainx zonk
Klo tarik tunai di alfa kena admin gak kak ?,1 tahun yang lalu,youtube,netral,klo tarik tunai alfa kena admin gak kak
Klo tarik tunai di alfa kena admin gak kak  ?,1 tahun yang lalu,youtube,netral,klo tarik tunai alfa kena admin gak kak
​ @LordDavinci-nx4tt  gak kena free,1 tahun yang lalu,youtube,netral,​ nxtt gak kena free
​ @LordDavinci-nx4tt engga kena admin. Tapi sekali salah transfer hangus,1 tahun yang lalu,youtube,netral,​ nxtt engga kena admin tapi sekali salah transfer hangus
"Dana gak aman , suruh ojk blok apk dana .DANA K*NT*L",1 tahun yang lalu,youtube,netral,dana gak aman suruh ojk blok apk dana dana kntl
Malu sama gopay gratis transfer 100x perbulan segala bank,1 tahun yang lalu,youtube,netral,malu sama gopay gratis transfer x perbulan segala bank
DANA bisa juga tarik lewat ATM tanpa kartu. Dimenu ATMi tarik tunai tanpa kartu,1 tahun yang lalu,youtube,netral,dana bisa tarik lewat atm tanpa kartu dimenu atmi tarik tunai tanpa kartu
"Tapi Dana Saldo sering ke tarik, apa lagi klo saldo smpe juta², tiba² hilang 😢",11 bulan yang lalu,youtube,negatif,tapi dana saldo sering tarik apa lagi klo saldo smpe juta² tiba² hilang 😢
"Dana saldo sering hilang,, dan cs ny kurang bertanggung jawab",9 bulan yang lalu,youtube,netral,dana saldo sering hilang cs ny kurang bertanggung jawab
28 September jam 09:19 saldo saya lenyap di DANA sebesar 7.000.000. DARI PIHAK DANA TIDAK tanggung jawab. Sudah komplain email live chat tidak diganti,7 bulan yang lalu,youtube,netral,september jam saldo lenyap dana sebesar pihak dana tidak tanggung jawab sudah komplain email live chat tidak diganti
Gopay diawasi OJK kalo Dana iya engga dia,1 tahun yang lalu,youtube,netral,gopay diawasi ojk kalo dana iya engga
Kata Siapa,1 tahun yang lalu,youtube,netral,kata siapa
Kalo dana diawasi konminfo kwsn,1 tahun yang lalu,youtube,netral,kalo dana diawasi konminfo kwsn
​ @EetBito-kx9zw mending ojk soalnya komdigi ini lagi terkait kasus si budie Ari,10 bulan yang lalu,youtube,netral,​ kxzw mending ojk soalnya komdigi lagi terkait kasus si budie ari
Uang gwe ilang di dana ga bisa kembali,1 tahun yang lalu,youtube,netral,uang gwe ilang dana ga bisa kembali
 @ivanariyanto8717  pake generator,1 tahun yang lalu,youtube,netral,pake generator
"​ @ivanariyanto8717  Ilang gmna bg awalnya, dan kok bisa ya 😢😢",1 tahun yang lalu,youtube,netral,​ ilang gmna bg awalnya kok bisa ya 😢😢
​ @ivanariyanto8717 sama,10 bulan yang lalu,youtube,netral,​ sama
Diawasi doank tapi kalo uang hilang /perusahaan bangkrut tidak diganti buat apa,9 bulan yang lalu,youtube,negatif,diawasi doank tapi kalo uang hilang perusahaan bangkrut tidak diganti buat apa
haduh,2 minggu yang lalu,youtube,netral,haduh
dana kok gk tanggung jawab sihh kehilangan dana ngakux gk ad transaksi,3 minggu yang lalu,youtube,netral,dana kok gk tanggung jawab sihh kehilangan dana ngakux gk ad transaksi
Dana gak aman,1 bulan yang lalu,youtube,netral,dana gak aman
"dana ewallet pertama saya sebelum saya migrasi ke seabank sebagai bank digital pertama saya, alangkah baik nya untuk ewallet menurut saya lebih bagus ovo flip gopay astrapay dan shoppepay ketimbang dana yg gratisan nya seuprit dan untuk bank digital yg saya rekomendasikan selain seabank ada krombank superbank allobank dan neobank agar duit kalian berbunga sedangkan ewallet sebagai dana cadangan kalau mau bayar tagihan beli pulsa/kuota.",1 bulan yang lalu (diedit),youtube,positif,dana ewallet pertama sebelum migrasi seabank sebagai bank digital pertama alangkah baik nya ewallet menurut lebih bagus ovo flip gopay astrapay shoppepay ketimbang dana yg gratisan nya seuprit bank digital yg rekomendasikan selain seabank ada krombank superbank allobank neobank agar duit kalian berbunga sedangkan ewallet sebagai dana cadangan kalau mau bayar tagihan beli pulsakuota
"aku lebih enak dana customer service ny melayani komplen dan langsung menyelesaikan masalah dengan cepat apa lgi soal saldo yg gagal lngsung balik dlm bbrp mnit, kl seabank customer servis ny satu arah, di chat cs ny cuma ada pertanyaan soal pengirim saldo tidak ada pilihan pertanyaan untuk yg penerima,",1 bulan yang lalu,youtube,netral,lebih enak dana customer service ny melayani komplen langsung menyelesaikan masalah cepat apa lgi soal saldo yg gagal lngsung balik dlm bbrp mnit kl seabank customer servis ny satu arah chat cs ny cuma ada pertanyaan soal pengirim saldo tidak ada pilihan pertanyaan yg penerima
"Dana sama seabank sama"" aman sih
Asalkan jangan ada yang di utak Atik, apalagi kalau ada pesan"" masuk yang mengatas namakan aplikasi tsb, 
Kalau sea bank menang nya kita nabung bisa nambah cuan",1 bulan yang lalu,youtube,positif,dana sama seabank sama aman sih asalkan jangan ada utak atik apalagi kalau ada pesan masuk mengatas namakan aplikasi tsb kalau sea bank menang nya kita nabung bisa nambah cuan
"DANA = Dompet Digital
SEABANK = BANK Digital

Mirip tapi beda jauh.",1 bulan yang lalu,youtube,netral,dana dompet digital seabank bank digital mirip tapi beda jauh
Jumlah saldo maksimal blm terjawab. Piyeee?,3 bulan yang lalu,youtube,netral,jumlah saldo maksimal blm terjawab piyeee
Pagi Bang. Maaf Bang sy ingin bertanya. SeaBank. Bagaimana cara mengganti E-walet yang terhubung apa bisa di ganti dengan DANA. Soalnya sy br bikin. Yg ada hanya ovo. mau sy ganti ke Dana. TRIms kasih,3 bulan yang lalu,youtube,netral,pagi bang maaf bang sy ingin bertanya seabank bagaimana cara mengganti ewalet terhubung apa bisa ganti dana soalnya sy br bikin yg ada hanya ovo mau sy ganti dana trims kasih
Menurut aku sih see bank enak kita nabung dapat bunga ..kalau dana enak juga buat segala macam transaksi juga bisa ..ada juga dana goals  bisa kita misalkan,3 bulan yang lalu,youtube,netral,menurut sih see bank enak kita nabung dapat bunga kalau dana enak buat segala macam transaksi bisa ada dana goals bisa kita misalkan
Aku pengguna Apl. dana namun aman aja asl jngn asal klik link,3 bulan yang lalu,youtube,positif,pengguna apl dana namun aman aja asl jngn asal klik link
"Sebenarnya aman pakai dana asal jgn sembarangan pencet link2 yg tdk jelas di hp.. krn banyak link2 , penipu intinya kita jg hrs waspada jgn mudah di iming2ngi dgn casing2 mengatasnamakan uang kaget dan lain2.. cuekin aja aman itu.. sy pakai dana aman2 dari dulu",3 bulan yang lalu,youtube,positif,sebenarnya aman pakai dana asal jgn sembarangan pencet link yg tdk jelas hp krn banyak link penipu intinya kita jg hrs waspada jgn mudah imingngi dgn casing mengatasnamakan uang kaget lain cuekin aja aman sy pakai dana aman dulu
Kalok seabank amanan sihh,4 bulan yang lalu,youtube,netral,kalok seabank amanan sihh
Danaaa sekarang tidak amann selaluu terpotong,4 bulan yang lalu,youtube,netral,danaaa sekarang tidak amann selaluu terpotong
Seabank dan shope pay.,4 bulan yang lalu,youtube,netral,seabank shope pay
"Terima kasih telah menunggu ya kaka, Mohon maaf atas ketidaknyamnnya ya kaka, kami informasikan seusai hasil pengecekan ya kaka, bahwa Sebelumnya, akun DANA Kakak sempat dibekukan sementara atas permintaan pihak BCA.

Jadi untuk koreksi saldo kaka tidak ada pengembalian ya kaka, karena hal tsb merupakan koordinasi kesepakatan dengan pihak BCA terkait transaksi yg tidak sah . Gue hapus apaan main koreksi saldo 149.500 udah kecewa pake dana",5 bulan yang lalu,youtube,negatif,terima kasih telah menunggu ya kaka mohon maaf atas ketidaknyamnnya ya kaka kami informasikan seusai hasil pengecekan ya kaka bahwa sebelumnya akun dana kakak sempat dibekukan sementara atas permintaan pihak bca koreksi saldo kaka tidak ada pengembalian ya kaka hal tsb merupakan koordinasi kesepakatan pihak bca terkait transaksi yg tidak sah gue hapus apaan main koreksi saldo udah kecewa pake dana
"Selama Pengalaman,DANA lah Yg Betul",6 bulan yang lalu,youtube,netral,selama pengalamandana lah yg betul
Nih kode baru RW4Q69,6 bulan yang lalu,youtube,netral,nih kode baru rwq
DANA jga aman di awasi oleh OJK,6 bulan yang lalu,youtube,positif,dana jga aman awasi oleh ojk
Seabank,7 bulan yang lalu,youtube,netral,seabank
Thanks untuk infonya kak 😊,1 bulan yang lalu,youtube,netral,thanks infonya kak 😊
"DANA sering hilang, dikit dikit di bekukan, kapok make aplikasi DANA, 1.900.000 UANG SAYA MELAYANG",1 bulan yang lalu,youtube,netral,dana sering hilang dikit dikit bekukan kapok make aplikasi dana uang melayang
 @fitraFirdaus-zn6qr  berarti mending di seabank dong bisa nambah cuan lumayan,1 bulan yang lalu,youtube,netral,znqr berarti mending seabank dong bisa nambah cuan lumayan
Di dana atau Seabank?,3 bulan yang lalu,youtube,netral,dana seabank
​ @sharingtutorial  seabank dan dana,3 bulan yang lalu,youtube,netral,​ seabank dana
"Gak bisa, itu emang udah dari bawaannya.",3 bulan yang lalu,youtube,netral,gak bisa emang udah bawaannya
​ @sharingtutorial ..Oo bgtu ya Bang. Soalnya ovo sy yg lama sdh tdk aktif. No no hp lama hangus dan email lupa,3 bulan yang lalu,youtube,netral,​ oo bgtu ya bang soalnya ovo sy yg lama sdh tdk aktif no no hp lama hangus email lupa
Betull bro,3 bulan yang lalu,youtube,netral,betull bro
Betul Pakai Banget 😊,12 hari yang lalu,youtube,netral,betul pakai banget 😊
Serius?,3 bulan yang lalu,youtube,netral,serius
 @MHusen-s8q  bner bnyak yg ngeluh kepotong g jls,3 bulan yang lalu,youtube,netral,sq bner bnyak yg ngeluh kepotong g jls
 @MHusen-s8q  iya saya aja di ambil trs ahirnya saya hapus apilkasi dana saya ganti shopipy mantap,2 bulan yang lalu,youtube,positif,sq iya aja ambil trs ahirnya hapus apilkasi dana ganti shopipy mantap
Tapi saya ngga ah aman ko,3 bulan yang lalu,youtube,positif,tapi ngga ah aman ko
 @PahmyRenjang_29  gak ah.. gw ajha make dana dr th 2021 smpe skrg aman2 ajha smpat fakum slm 2 th dgn mehapus aplikasi nya meninggalkan saldo 18000  pas di cek lagi mau pake saldo ttp utuh,2 bulan yang lalu,youtube,netral,gak ah gw ajha make dana dr th smpe skrg aman ajha smpat fakum slm th dgn mehapus aplikasi nya meninggalkan saldo pas cek lagi mau pake saldo ttp utuh
betul klo ada potongan pasti anda ada tagihan tertentu yg belom di byar kan,2 minggu yang lalu,youtube,netral,betul klo ada potongan pasti anda ada tagihan tertentu yg belom byar kan
gk di awasi ojk,5 bulan yang lalu,youtube,netral,gk awasi ojk
Ewallet tidak dijamin LPS Dan tidak diawasi OJK. hanya izin BI & kondigi saja,4 bulan yang lalu,youtube,netral,ewallet tidak dijamin lps tidak diawasi ojk hanya izin bi kondigi saja
Mksh bang infonya,7 bulan yang lalu,youtube,netral,mksh bang infonya
Seabank sy kebobol 18jt. Transfer ke alamat g d kenal . G ada notif otp & hp selalu d samping jam & tanggal itu. Gmn ya kk?,7 bulan yang lalu,youtube,netral,seabank sy kebobol jt transfer alamat g d kenal g ada notif otp hp selalu d samping jam tanggal gmn ya kk
bang atasi kendala transaksi ngirim ke apk dana di riwayatnya masuk tapi di no tujuan gamasuk uda 7 hati saldo blom balik,8 bulan yang lalu,youtube,netral,bang atasi kendala transaksi ngirim apk dana riwayatnya masuk tapi no tujuan gamasuk uda hati saldo blom balik
"Saya juga mau simpan uang di seabank kira kira aman gak ya,pernah dina dana nominal kecil aman pas nominal gede malah ada langganan lumayan ilang nya gede ,kalo seabang saya baru bikin belum terkait sama yang lain",8 bulan yang lalu,youtube,positif,mau simpan uang seabank kira kira aman gak yapernah dina dana nominal kecil aman pas nominal gede malah ada langganan lumayan ilang nya gede kalo seabang baru bikin belum terkait sama lain
Bang aku baru download mau tanya kalau misal bayar pakai QR dana atau QR lain yang biasanya ada di tempat usaha seperti warung bisa gak?,8 bulan yang lalu,youtube,netral,bang baru download mau tanya kalau misal bayar pakai qr dana qr lain biasanya ada tempat usaha seperti warung bisa gak
Bang atasi saldo sebank masih kosong padahal ada riwayat transaksi sukses terima uang  di sebank nya,9 bulan yang lalu,youtube,positif,bang atasi saldo sebank masih kosong padahal ada riwayat transaksi sukses terima uang sebank nya
"mau cerita aja, ada temen yg tiba tiba ilang uang di Dana pas baru isi saldo, hape android. jadi Dana menurut saya kurang aman. saya udah pake seabank cukup lama dan aman. kalo mau deposito tapi ga fleksibel kalo di seabank",9 bulan yang lalu,youtube,netral,mau cerita aja ada temen yg tiba tiba ilang uang dana pas baru isi saldo hape android dana menurut kurang aman udah pake seabank cukup lama aman kalo mau deposito tapi ga fleksibel kalo seabank
Lah kok bisaa bang? Itu terjadi kapan?,7 bulan yang lalu,youtube,netral,lah kok bisaa bang terjadi kapan
​ @Romanee278 paling gak sengaja itu mencet link atau data dia di retas,7 bulan yang lalu,youtube,netral,​ paling gak sengaja mencet link data retas
Yang bener bang 18 jt di Seabank Ludes karna di bobol..😢,6 bulan yang lalu,youtube,netral,bener bang jt seabank ludes karna bobol😢
​ @ZeoWirboy Luhh tanya atau ksh info sihh,3 bulan yang lalu,youtube,netral,​ luhh tanya ksh info sihh
Human error kayaknya,4 bulan yang lalu,youtube,negatif,human error kayaknya
"Makanya jgn asal2 pencet link,, target penipu itu org2 yg tolol yg haus dptin uang instan",2 bulan yang lalu,youtube,negatif,makanya jgn asal pencet link target penipu org yg tolol yg haus dptin uang instan
Pake rekening bank apa?,8 bulan yang lalu,youtube,netral,pake rekening bank apa
​ @sharingtutorial pake seabank bang,8 bulan yang lalu,youtube,netral,​ pake seabank bang
​ @sharingtutorial pake seabank,8 bulan yang lalu,youtube,netral,​ pake seabank
Sama bang sy juga pernah hilang uang 200 ribu pas di cek ada akun google yg terhubung dgn aplikasi sy lupa namanya semacam BIGO live.,5 bulan yang lalu (diedit),youtube,negatif,sama bang sy pernah hilang uang ribu pas cek ada akun google yg terhubung dgn aplikasi sy lupa namanya semacam bigo live
​ @rif6458 klo apk terhubung itu kesalahan diri sendiri sih makanya jgn d klik langganan aplikasi ke dana. Gw pake dana gk prnh ke potong krn gw gk prnh kaitkan dgn aplikasi appn,4 bulan yang lalu,youtube,netral,​ klo apk terhubung kesalahan diri sendiri sih makanya jgn d klik langganan aplikasi dana gw pake dana gk prnh potong krn gw gk prnh kaitkan dgn aplikasi appn
Asal mencet2 link lu,2 bulan yang lalu,youtube,netral,asal mencet link lu
Seharusnya bisa tapi alangkah baiknya jika kita tanya dulu sebelum bayar untuk memastikan.,8 bulan yang lalu,youtube,netral,seharusnya bisa tapi alangkah baiknya jika kita tanya dulu sebelum bayar memastikan
"Bis abang, customer saya bayar lewat qris, pake seabnk",5 bulan yang lalu,youtube,netral,bis abang customer bayar lewat qris pake seabnk
Sma knpa yh,9 bulan yang lalu,youtube,netral,sma knpa yh
Udah berapa lama gak masuk ke SeaBank?,9 bulan yang lalu,youtube,netral,udah berapa lama gak masuk seabank
Kejadian tanggal 24 langsung chat cs kata ny bisa aktif kembali tnggl 26 pas saya cek jam 1mlm tanggal 26 saldo sudah normal,9 bulan yang lalu,youtube,netral,kejadian tanggal langsung chat cs kata ny bisa aktif kembali tnggl pas cek jam mlm tanggal saldo sudah normal
​@smiledotcom6974bang kenapa yah qta tlfn cs seabank perlu pulsa banyak.,7 bulan yang lalu,youtube,netral,​ kenapa yah qta tlfn cs seabank perlu pulsa banyak
"Sepengalaman saya,jika ada seseorang ingin transfer uang lalu salah nomor dan kebetulan orang itu pakai nmr kita,tapi dia blm kirim cuma baru mau kirim,misal kirim 50k kemudian dia baru memasukan nmr kita blm memasukan katasandi atau blm sah transfer, lalu orang itu mengecek ternyata salah nmr tujuan,dan tidak jadi transfer, tapi karena nmr kita sudah di masukan untuk nomor tujuan mereka, akhirnya notifikasi transaksi muncul,tapi saldo tidak kita terima,itulah pengalaman saya semoga membantu ya😁",9 bulan yang lalu,youtube,netral,sepengalaman sayajika ada seseorang ingin transfer uang lalu salah nomor kebetulan orang pakai nmr kitatapi blm kirim cuma baru mau kirimmisal kirim k kemudian baru memasukan nmr kita blm memasukan katasandi blm sah transfer lalu orang mengecek ternyata salah nmr tujuandan tidak transfer tapi nmr kita sudah masukan nomor tujuan mereka akhirnya notifikasi transaksi muncultapi saldo tidak kita terimaitulah pengalaman semoga membantu ya😁
Alhamdulillah udah bisa nunggu 3 hari saldo kembali 😊,9 bulan yang lalu,youtube,netral,alhamdulillah udah bisa nunggu hari saldo kembali 😊
"Alhamdulillah kalau gitu, kalau boleh tau transferan dari bank apa ya ?",9 bulan yang lalu,youtube,netral,alhamdulillah kalau gitu kalau boleh tau transferan bank apa ya
"Pake keamanan deteksi wajah, klo ilang berati ya itu buat bayar langganan otomatis, matikan langganan otomatisnya",6 bulan yang lalu,youtube,netral,pake keamanan deteksi wajah klo ilang berati ya buat bayar langganan otomatis matikan langganan otomatisnya
"Pengalaman saya, anak saya main apk Roblox eh gak tau dia beli apa di Roblox, pas lihat saldo dana gak ada uang 40rbu, pas di cek transaksi nya ada tulisan Roblox google crome, 20rbu 2x.
Gmna coba cara kesedot nya, anak saya kan gak tau pin nya tapi kepotong sendiri di saldo",5 bulan yang lalu,youtube,netral,pengalaman anak main apk roblox eh gak tau beli apa roblox pas lihat saldo dana gak ada uang rbu pas cek transaksi nya ada tulisan roblox google crome rbu x gmna coba cara kesedot nya anak kan gak tau pin nya tapi kepotong sendiri saldo
Makasih sharingnya kawan 😊,9 bulan yang lalu,youtube,netral,makasih sharingnya kawan 😊
Bisa d tarik semua ga saldo di sea bank,8 bulan yang lalu,youtube,netral,bisa d tarik semua ga saldo sea bank
​ @DevankaArfabian bisa bang sampe habis,8 bulan yang lalu,youtube,netral,​ bisa bang sampe habis
​ @DevankaArfabian  TF pun 100x gratis selama sebulan,8 bulan yang lalu,youtube,netral,​ tf pun x gratis selama sebulan
 @DevankaArfabian bisa. rata rata bank digital ga perlu saldo mengendap,8 bulan yang lalu,youtube,netral,bisa rata rata bank digital ga perlu saldo mengendap
"Ini yg uplod ngebelain seabank banget.. 😂
Lucuu",7 bulan yang lalu,youtube,netral,yg uplod ngebelain seabank banget 😂 lucuu
Maksudnya ga fleksibel itu gimana ya? DANA lebih mudah dipakai daripada seabank gitu kah?,7 bulan yang lalu,youtube,positif,maksudnya ga fleksibel gimana ya dana lebih mudah dipakai daripada seabank gitu kah
"⁠ @skafu9229 pengalaman saya di seabank, tidak bisa cairkan deposito sampai tanggal jatuh tempo. jadi kalau perlu dana darurat tidak bisa dipakai uangnya sampai akhir waktu deposito",7 bulan yang lalu,youtube,netral,⁠ pengalaman seabank tidak bisa cairkan deposito sampai tanggal jatuh tempo kalau perlu dana darurat tidak bisa dipakai uangnya sampai akhir waktu deposito
Itu teman kau ada langganan di apk sama bayar otomatis dananya kocak bukan dananya yang disalahin wkwk,9 bulan yang lalu,youtube,netral,teman kau ada langganan apk sama bayar otomatis dananya kocak bukan dananya disalahin wkwk
​​ @tantejangan6435 pembayaran otomatis bukan nya harus tetap memasukkan pin ?,8 bulan yang lalu (diedit),youtube,netral,​​ pembayaran otomatis bukan nya harus tetap memasukkan pin
" @tantejangan6435 katanya sih ga ada langganan apapun. dan itu ilang nya ga lama abis top up, mungkin 5 menit",9 bulan yang lalu,youtube,positif,katanya sih ga ada langganan apapun ilang nya ga lama abis top up mungkin menit
Ovo enak y ada kunci akun tpi mahal..kirim mahal nrima jga k potong..klo dana murah tf k mna2 tpi udh ada yg k jadian ilang saldo y,3 bulan yang lalu,youtube,netral,ovo enak y ada kunci akun tpi mahalkirim mahal nrima jga k potongklo dana murah tf k mna tpi udh ada yg k jadian ilang saldo y
"Jangan pakai Gopay.Saldoku belum balik,sudah 6 hari.Kantor fisik juga gak ada.",5 bulan yang lalu,youtube,netral,jangan pakai gopaysaldoku belum baliksudah harikantor fisik gak ada
Gopay dong,5 bulan yang lalu,youtube,netral,gopay dong
