komentar,timestamp,platform,sentimen,clean
"semuanya saya pake kecuali linkaja
yang saya manfaatkan disini adalah fitur transfer nya dan top up nya bisa di mini market",6 tahun yang lalu,youtube,positif,semuanya pake kecuali linkaja manfaatkan disini adalah fitur transfer nya top up nya bisa mini market
8:47-8:51😁,6 tahun yang lalu,youtube,netral,😁
Waduh ayo jangan salah fokus.. kita #mulaisekarang belajar kelola uang 😂,6 tahun yang lalu,youtube,netral,waduh ayo jangan salah fokus kita belajar kelola uang 😂
Itu maharnya gede loh bang... Loe harus bisa beli kereta api buat dapetin dia..? Apa loe mampu?,6 tahun yang lalu,youtube,netral,maharnya gede loh bang loe harus bisa beli kereta api buat dapetin apa loe mampu
 @danielsan7368  wanjir beli kreta api 🤣🤣🤣,6 tahun yang lalu,youtube,netral,wanjir beli kreta api 🤣🤣🤣
 @danielsan7368   Sriwihastomo Arief Maulana  maafkan saudara salah sebut namanya juga manusia.. dan belum di edit dikasih tulisan sebagai penanda. Lumayan hiburan ya.. semoga next bisa semakin baik lagi dalam memberikan informasi 😂,6 tahun yang lalu,youtube,netral,sriwihastomo arief maulana maafkan saudara salah sebut namanya manusia belum edit dikasih tulisan sebagai penanda lumayan hiburan ya semoga next bisa semakin baik lagi dalam memberikan informasi 😂
Kalo pake jenius free kak.. kepotong dari gratis kuota nya aja kayaknya. Pakai DANA juga bisa untuk top up tinggal di send to nobu bank 9+ nomor ovo,6 tahun yang lalu,youtube,positif,kalo pake jenius free kak kepotong gratis kuota nya aja kayaknya pakai dana bisa top up tinggal send to nobu bank nomor ovo
 @FINTALK  terimakasih ka chanel fintalk emang the best deh untuk edukasi seputar keuangan,6 tahun yang lalu,youtube,netral,terimakasih ka chanel fintalk emang the best deh edukasi seputar keuangan
" @FINTALK  tadi saya pakek jenius kok ga gratis ka, biyaya adminnya 3k?",6 tahun yang lalu,youtube,netral,tadi pakek jenius kok ga gratis ka biyaya adminnya k
Biaya topup Rp1000 mulai besok tgl 2 Maret. Sekarang masih tgl 1 Maret. Oh My God....,6 tahun yang lalu,youtube,netral,biaya topup rp mulai besok tgl maret sekarang masih tgl maret oh my god
 @kangdalwae6441  pakai jenius masih free cuma kepotong kuota gratis sajaa,6 tahun yang lalu,youtube,netral,pakai jenius masih free cuma kepotong kuota gratis sajaa
Pakai untuk beli tiket kereta juga okee,6 tahun yang lalu,youtube,netral,pakai beli tiket kereta okee
Bukan beli kereta ya kak?,6 tahun yang lalu,youtube,netral,bukan beli kereta ya kak
Banyak kelebihan nya karena pemain unggulan dan cukup pertama kali booming,6 tahun yang lalu,youtube,netral,banyak kelebihan nya pemain unggulan cukup pertama kali booming
Typo is real 😁,6 tahun yang lalu,youtube,netral,typo is real 😁
"Linkaja buat krl iss oke, soalny kadang aku kelupaan bawa kartu mhsw 😄",6 tahun yang lalu,youtube,netral,linkaja buat krl iss oke soalny kadang kelupaan bawa kartu mhsw 😄
Kl promo semakin hilang. Kamu  ttp cinta? 😄,6 tahun yang lalu,youtube,netral,kl promo semakin hilang ttp cinta 😄
No promo no party ya bang... Ya jelas itu BUMN punya.. para pemain BUMN maunya berat.. kalo gak banyak bini ya banyak gundik..tuh liat Dirut Garuda..hahahaha,6 tahun yang lalu,youtube,netral,no promo no party ya bang ya jelas bumn punya para pemain bumn maunya berat kalo gak banyak bini ya banyak gundiktuh liat dirut garudahahahaha
Bisa tf ke bank gak Ka?,6 tahun yang lalu,youtube,netral,bisa tf bank gak ka
"Gak mungkin gua udah 3 bulan pake tpi sakses terus,,sebulan saya transfer dan bertransaksi aman"" aja",5 tahun yang lalu,youtube,netral,gak mungkin gua udah bulan pake tpi sakses terussebulan transfer bertransaksi aman aja
"Salah satu kekurangan digital, terkadang ada aja masalah seperti ini",6 tahun yang lalu,youtube,netral,salah satu kekurangan digital terkadang ada aja masalah seperti
Ke cs dong,6 tahun yang lalu,youtube,netral,cs dong
"Dana, transfer ke semua bank gratis 10 kali pertama, dalam 1 bulan, berikutnya bayar.",6 tahun yang lalu,youtube,netral,dana transfer semua bank gratis kali pertama dalam bulan berikutnya bayar
Gk mungkin,5 tahun yang lalu,youtube,netral,gk mungkin
Banyak juga kak akun-nya 🤔,6 tahun yang lalu,youtube,netral,banyak kak akunnya 🤔
" @FINTALK  cman pake satu sim card ka, tpi dftr dri bbrpa e wallet",6 tahun yang lalu,youtube,netral,cman pake satu sim card ka tpi dftr dri bbrpa e wallet
Gue bngetttt.... Mana promo yg besar kearah situ,6 tahun yang lalu,youtube,netral,gue bngetttt mana promo yg besar kearah situ
"Sekarang mulai menurun nih promonya, tanda tanda bakar duit sudah minim. Dan promo mulai diakali dengan kenaikan harga lebih dulu",6 tahun yang lalu,youtube,netral,sekarang mulai menurun nih promonya tanda tanda bakar duit sudah minim promo mulai diakali kenaikan harga lebih dulu
Kamu ga sendirian 😁,5 tahun yang lalu,youtube,netral,ga sendirian 😁
"Iya bener banget, lebih cuan pakai biru ya sekarang kam",6 tahun yang lalu,youtube,netral,iya bener banget lebih cuan pakai biru ya sekarang kam
Dana maksud lu?,4 tahun yang lalu,youtube,netral,dana maksud lu
Tidak kak. Hilang kalau kita belanjain hihi. Atau ada pencurian data nasabah seperti kejahatan siber,6 tahun yang lalu,youtube,negatif,tidak kak hilang kalau kita belanjain hihi ada pencurian data nasabah seperti kejahatan siber
Pertanyaan bodoh😄😄,6 tahun yang lalu,youtube,netral,pertanyaan bodoh😄😄
"Bisa hilang kalau jaringan internet dirusak sampai parahnya, misal invasi alien... Wkwkwk",6 tahun yang lalu,youtube,negatif,bisa hilang kalau jaringan internet dirusak sampai parahnya misal invasi alien wkwkwk
 @kangdalwae6441  sangat konspirasi ya kak 😂,6 tahun yang lalu,youtube,netral,sangat konspirasi ya kak 😂
"dana juga gede sekarang kak diskonya, lumayan mumpung masih bakar duit",6 tahun yang lalu,youtube,netral,dana gede sekarang kak diskonya lumayan mumpung masih bakar duit
" @FINTALK  oya kak mau ngasih inpoh nih, u linkaja skrg transaksi dibatasi cuma 3x doang, yg sbelum2nya 10x turun 5x turun lagi 3x, kek ngak niat jual produk, terus komplain via tweet responya lelet bgt bhkan bisa berhari2 br dibls.",6 tahun yang lalu,youtube,netral,oya kak mau ngasih inpoh nih u linkaja skrg transaksi dibatasi cuma x doang yg sbelumnya x turun x turun lagi x kek ngak niat jual produk terus komplain via tweet responya lelet bgt bhkan bisa berhari br dibls
"Betul sekali, pas verifikasi ktp sy ragu..bisa gak ya soalnya ktp dah rusak lapisan luar dah terlepas, sbagian tulisan ada yg ikut terlepas, trus foto pas diwajah dah ada goresan tinta atau apa gitu, mau tak bersihin takut malah buram..taunya pas verifikasi langsung berhasil, senang sekali😀",6 tahun yang lalu,youtube,netral,betul sekali pas verifikasi ktp sy ragubisa gak ya soalnya ktp dah rusak lapisan luar dah terlepas sbagian tulisan ada yg ikut terlepas trus foto pas diwajah dah ada goresan tinta apa gitu mau tak bersihin takut malah buramtaunya pas verifikasi langsung berhasil senang sekali😀
"Gue upgrade ke premium di dana, gagal mulu, foto agak burem.",6 tahun yang lalu,youtube,negatif,gue upgrade premium dana gagal mulu foto agak burem
 @ganjarnugraha4763  diperhatikan lagi kak kualitas fotonya..,6 tahun yang lalu,youtube,netral,diperhatikan lagi kak kualitas fotonya
betul betul betul,5 tahun yang lalu,youtube,netral,betul betul betul
Aku yg punya kamera burik. Pinjem hp orsng buat verifikasi. Aowkwkwk,5 tahun yang lalu,youtube,netral,yg punya kamera burik pinjem hp orsng buat verifikasi aowkwkwk
hahahha sudah ada kak malahan tukang cilok bayarnya via dompet digital,6 tahun yang lalu,youtube,netral,hahahha sudah ada kak malahan tukang cilok bayarnya via dompet digital
masalah teknis untuk aplikasi baru emang kadang suka terjadi kak.. link aja masih belum bisa nyalip pendahulunya nih ovo gopay dan dana. Dia masih belum se 'bakar' duit itu,6 tahun yang lalu,youtube,netral,masalah teknis aplikasi baru emang kadang suka terjadi kak link aja masih belum bisa nyalip pendahulunya nih ovo gopay dana masih belum se bakar duit
" @FINTALK  ooo pantes, trimksih infonya, baru bbrp hari lalu sy dfr dana, lumayan blom ada problem.",6 tahun yang lalu,youtube,netral,ooo pantes trimksih infonya baru bbrp hari lalu sy dfr dana lumayan blom ada problem
"Alhamdulillah utk nomor 1 belum pernah, tapi nomor 2 & 3 pernah... hehe",6 tahun yang lalu,youtube,netral,alhamdulillah utk nomor belum pernah tapi nomor pernah hehe
waduh nggak kak.. cuma review pemakaian. Semoga abis ini di sponsorin dan di endorse kak hehehe,6 tahun yang lalu,youtube,netral,waduh nggak kak cuma review pemakaian semoga abis sponsorin endorse kak hehehe
"gopay penggunanya lbh banyak kelas menengah atas.. dan gopay pihak langsung dari gojek, ga pake pihak ketiga... sy pribadi lbh nyaman gopay",5 tahun yang lalu,youtube,positif,gopay penggunanya lbh banyak kelas menengah atas gopay pihak langsung gojek ga pake pihak ketiga sy pribadi lbh nyaman gopay
"Masih bisa via transfer bank, virtual account Toko di dunia maya, konter pulsa juga bisa...",6 tahun yang lalu,youtube,netral,masih bisa via transfer bank virtual account toko dunia maya konter pulsa bisa
sekarang udah mulai abis kak promonya.. jadi ada yang berbayar,6 tahun yang lalu,youtube,netral,sekarang udah mulai abis kak promonya ada berbayar
Ovo mulai gak bersahabat kaya dulu,6 tahun yang lalu,youtube,netral,ovo mulai gak bersahabat kaya dulu
Kena charge.,5 tahun yang lalu,youtube,netral,kena charge
"iya betul kak.. mulai pertengahan desember nanti. Salah satunya selain sahamnya udah di lepas, udah bakar duit terus gede gedean kak..",6 tahun yang lalu,youtube,netral,iya betul kak mulai pertengahan desember nanti salah satunya selain sahamnya udah lepas udah bakar duit terus gede gedean kak
Ovo Per tanggal 1 maret juga ada biaya top up 1000,6 tahun yang lalu,youtube,positif,ovo per tanggal maret ada biaya top up
 @isaaalproject  Tgl 2 Maret 2020,6 tahun yang lalu,youtube,netral,tgl maret
"Bbrp hari ini transfer ke bank pakai dana gratis 10 kali per bulan, tapi syaratnya utk nominal transfer harus minimal 50rb. Di bawah 50rb kalau tidak salah ada biaya 4500.",5 tahun yang lalu,youtube,netral,bbrp hari transfer bank pakai dana gratis kali per bulan tapi syaratnya utk nominal transfer harus minimal rb bawah rb kalau tidak salah ada biaya
"Maaf nanya Gan, kalo Dana itu pulsanya murah gak ya?
Trimksih sblumnya,..",6 tahun yang lalu,youtube,netral,maaf nanya gan kalo dana pulsanya murah gak ya trimksih sblumnya
 @osengngapak  murah kak,6 tahun yang lalu,youtube,netral,murah kak
"@GG GαρlєχGαмιиɢッ makasih inponya, bbrp hr lalu langsung dftr dana, lumayan blom ada problem, cuma pulsa tsel 5 ama yg 10k gak ada, coba kalo ada..wuih mantab, maklum tetanggaku sering beli 5k & 10k soalnya.",6 tahun yang lalu (diedit),youtube,netral,gαρlєχgαмιиɢッ makasih inponya bbrp hr lalu langsung dftr dana lumayan blom ada problem cuma pulsa tsel ama yg k gak ada coba kalo adawuih mantab maklum tetanggaku sering beli k k soalnya
iya betul lumayan gratis transfer jadi bisa lebih hemat kak..,6 tahun yang lalu,youtube,netral,iya betul lumayan gratis transfer bisa lebih hemat kak
salah sebut ka hahaha. Makasih sudah nonton,6 tahun yang lalu,youtube,netral,salah sebut ka hahaha makasih sudah nonton
Buat beli kereta api,6 tahun yang lalu,youtube,netral,buat beli kereta api
Beli kereta api dong hahaha,5 tahun yang lalu,youtube,netral,beli kereta api dong hahaha
"Kelemahan semua dompet digital itu adalah,,, kalo batre mati , ditambah sinyal mati, auto miskin bauhahah",6 tahun yang lalu,youtube,netral,kelemahan semua dompet digital adalah kalo batre mati ditambah sinyal mati auto miskin bauhahah
"Yup betul banget, dlu pernah buru2 pergi dri magelang ke yogya lupa bawa dompet, mau tarik tunai di alfa data internet hbs, untung mas2 nya yg jaga alfa mau hotspot in",6 tahun yang lalu,youtube,netral,yup betul banget dlu pernah buru pergi dri magelang yogya lupa bawa dompet mau tarik tunai alfa data internet hbs untung mas nya yg jaga alfa mau hotspot in
Setujuuuuuu buanget tuch,5 tahun yang lalu,youtube,netral,setujuuuuuu buanget tuch
Hahhaha. Iya bro,5 tahun yang lalu,youtube,netral,hahhaha iya bro
Dompet ampek ngjudel diikat pakek karet trus jatuh low g dcopet sama juga boong😁😁😁ada minus ada plusnya,5 tahun yang lalu,youtube,netral,dompet ampek ngjudel diikat pakek karet trus jatuh low g dcopet sama boong😁😁😁ada minus ada plusnya
Oalah tuambah rame hahaha,5 tahun yang lalu,youtube,netral,oalah tuambah rame hahaha
😅😅😅👍👍,4 tahun yang lalu,youtube,netral,😅😅😅👍👍
"Kan ada pawerbank, trs ada wifi yg bisa di bawa yg kecill",4 tahun yang lalu,youtube,netral,kan ada pawerbank trs ada wifi yg bisa bawa yg kecill
Dan kelemahan sebenrnya ada alah kasihan yg ga tau apa apa,4 tahun yang lalu,youtube,netral,kelemahan sebenrnya ada alah kasihan yg ga tau apa apa
Betul sekali apalagi kalau nemu daerah yg sinyalnya susah waduuh jadi gerah juga,3 tahun yang lalu,youtube,netral,betul sekali apalagi kalau nemu daerah yg sinyalnya susah waduuh gerah
"Itulah kelemahan di era digital nih, jaman serba cepat tapi jadi ketergantungan sama smartphone :)",6 tahun yang lalu,youtube,positif,itulah kelemahan era digital nih jaman serba cepat tapi ketergantungan sama smartphone
Ces lah,4 tahun yang lalu,youtube,netral,ces lah
"Ditambah minta hotspot,terus kata sandi nya (beli kuota oy)😂😂 +++ maluuu🗿",3 tahun yang lalu,youtube,netral,ditambah minta hotspotterus kata sandi nya beli kuota oy😂😂 maluuu🗿
Wkwk... komen tergokil,3 tahun yang lalu,youtube,netral,wkwk komen tergokil
🤣🤣🤣 Benar sekali👍👍🤣,3 tahun yang lalu,youtube,netral,🤣🤣🤣 benar sekali👍👍🤣
Saya selalu bwa power bank yg 20rb mah jd hpe sya tdk pernh mati,2 tahun yang lalu,youtube,netral,selalu bwa power bank yg rb mah jd hpe sya tdk pernh mati
Smartphone jadi pemeran penting,2 tahun yang lalu,youtube,netral,smartphone pemeran penting
Mksdnya gimana? Uang hilabg srmua gitu ?,6 tahun yang lalu,youtube,netral,mksdnya gimana uang hilabg srmua gitu
 @andikaheriyanto705  mksdnya jika anda punya e-wallet ada saldo 1 Milyar nah jika ga terhubung inet mah ga bisa buat bayar/belanja,6 tahun yang lalu,youtube,netral,mksdnya jika anda punya ewallet ada saldo milyar nah jika ga terhubung inet mah ga bisa buat bayarbelanja
Mbak nya trtawa membaca ini,5 tahun yang lalu,youtube,netral,mbak nya trtawa membaca
Apa belum pada Coba Speedcash kah kawan²??,8 hari yang lalu,youtube,netral,apa belum pada coba speedcash kah kawan²
Saya kecewa sama dana karena pas perlu malah transaksi nya gagal karena masalh keamanan,10 hari yang lalu,youtube,negatif,kecewa sama dana pas perlu malah transaksi nya gagal masalh keamanan
Pake dana ribet tapi goopay tetap yang terbaik,2 bulan yang lalu,youtube,negatif,pake dana ribet tapi goopay tetap terbaik
Bagus,3 bulan yang lalu,youtube,positif,bagus
harus punya rekening bca dulu buat top up,4 bulan yang lalu,youtube,positif,harus punya rekening bca dulu buat top up
"Kak, kalo pake brimo aman ga buat nyimpan saldo? Tapi saya belum ada rekening dan belum pernah pake sama sekali apakah bisa daftar brimo dan bisa langsung simpan saldonya? 
Terus apakah rekening yang dibuat dari aplikasi brimo yang saya daftarkan tadi bisa digunakan secara offline? 
Terus kalo simpan di brimo harus bayar setoran ya.. Kalo ga bayar nanti bisa dibekukan?",5 bulan yang lalu,youtube,positif,kak kalo pake brimo aman ga buat nyimpan saldo tapi belum ada rekening belum pernah pake sama sekali apakah bisa daftar brimo bisa langsung simpan saldonya terus apakah rekening dibuat aplikasi brimo daftarkan tadi bisa digunakan secara offline terus kalo simpan brimo harus bayar setoran ya kalo ga bayar nanti bisa dibekukan
Ovo mercant biaya admin mhal bnget,5 bulan yang lalu,youtube,netral,ovo mercant biaya admin mhal bnget
Gue pake aplikasi dana selama ini aman aja nyimpan duit ampe juta,7 bulan yang lalu,youtube,positif,gue pake aplikasi dana selama aman aja nyimpan duit ampe juta
Saya jjur kecewa sama dana saya sudah 3 kali ajukan ganti nomor di persulit nomor sudah tidak aktif mau saya ganti susah,7 bulan yang lalu,youtube,negatif,jjur kecewa sama dana sudah kali ajukan ganti nomor persulit nomor sudah tidak aktif mau ganti susah
shopeepay bs untuk nabung gak sih? sbb skrg lg rame berita klo rekening nganggur bakal dibekukan,8 bulan yang lalu,youtube,netral,shopeepay bs nabung gak sih sbb skrg lg rame berita klo rekening nganggur bakal dibekukan
Keren min jdi tau jenis jenis wallet,9 bulan yang lalu,youtube,positif,keren min jdi tau jenis jenis wallet
Tim yg masih pake debit😂 males banget soalnya data kita bisa kebaca,9 bulan yang lalu,youtube,netral,tim yg masih pake debit😂 males banget soalnya data kita bisa kebaca
"Yang mau gratis admin isi saldonya ini rankingnya
1. Gopay/Bank JAGO unlimited/gratis admin via virtual account setiap bank 5 kali tanpa syarat minimum 
2. ShopeePay/SeaBank Unlimited/gratis admin 5 kali saja dari transfer bank syarat 50K minimal/Indomaret 3 kali setor tunai Syarat 50K minimal 
3. Dana belum pernah nyoba😂",10 bulan yang lalu,youtube,netral,mau gratis admin isi saldonya rankingnya gopaybank jago unlimitedgratis admin via virtual account setiap bank kali tanpa syarat minimum shopeepayseabank unlimitedgratis admin kali saja transfer bank syarat k minimalindomaret kali setor tunai syarat k minimal dana belum pernah nyoba😂
shopepay aman ga? izin nanya 🙏,11 bulan yang lalu,youtube,positif,shopepay aman ga izin nanya 🙏
😂😂😂 dana sering nyuri saldo,1 tahun yang lalu,youtube,netral,😂😂😂 dana sering nyuri saldo
Kalo buat nyimpen uang yg paling aman yg mana ovo ato gopay,1 tahun yang lalu,youtube,positif,kalo buat nyimpen uang yg paling aman yg mana ovo ato gopay
Paling suka gopay gratis transer 100x perbulan mantap gk lemot lagi pokoknya gopay jos bnyk promo dan beli pulsa juga murah,1 tahun yang lalu,youtube,netral,paling suka gopay gratis transer x perbulan mantap gk lemot lagi pokoknya gopay jos bnyk promo beli pulsa murah
Aku pengguna Nucash App 🙋🏻‍♂️,1 tahun yang lalu,youtube,netral,pengguna nucash app 🙋🏻‍♂️
"Gua si gopay soalnya, pulsa sama kouta nya murah murah cuyy",1 tahun yang lalu,youtube,netral,gua si gopay soalnya pulsa sama kouta nya murah murah cuyy
"Mnrutku yg pling Aman LinkAja klo ada mslah lgsg ke grapari aja, awal dri T-cash jdi linkAja cma yaa msih mhal msal tf ke bank msih 6500, lbih enak pkk gopay biaya murah",1 tahun yang lalu,youtube,positif,mnrutku yg pling aman linkaja klo ada mslah lgsg grapari aja awal dri tcash jdi linkaja cma yaa msih mhal msal tf bank msih lbih enak pkk gopay biaya murah
ga harus bca sih kak,4 bulan yang lalu,youtube,netral,ga harus bca sih kak
pake apa aja yg bisa,4 bulan yang lalu,youtube,netral,pake apa aja yg bisa
langsung tanya ke cs bank bri saja kak,5 bulan yang lalu,youtube,netral,langsung tanya cs bank bri saja kak
​ @situsgadget Ok kak,5 bulan yang lalu,youtube,netral,​ ok kak
iya lagi 😢,5 bulan yang lalu,youtube,netral,iya lagi 😢
"Masa sih bang, saya no sudah mati tapi masih bisa masuk kok..",7 bulan yang lalu,youtube,netral,masa sih bang no sudah mati tapi masih bisa masuk kok
Iya gimana yah caranya hp saya hilang,6 bulan yang lalu,youtube,negatif,iya gimana yah caranya hp hilang
Aku bulan kmren bisa kok ganti nomorku yg hilang,6 bulan yang lalu,youtube,negatif,bulan kmren bisa kok ganti nomorku yg hilang
bisa kak,8 bulan yang lalu,youtube,netral,bisa kak
Aman aja,10 bulan yang lalu,youtube,positif,aman aja
Betul sekali jangan pake ewalet dana saldo suka hilang pas di tanyain lewat cs nya jawaban nya ga pernah nyambung.maslah tidak dapat teratasi saldo ga bisa balik lagi malah bilang nya harus lapor ke kepolisian haha,11 bulan yang lalu (diedit),youtube,negatif,betul sekali jangan pake ewalet dana saldo suka hilang pas tanyain lewat cs nya jawaban nya ga pernah nyambungmaslah tidak dapat teratasi saldo ga bisa balik lagi malah bilang nya harus lapor kepolisian haha
sama kejadian nya kaya saya tiba2 logout terus ga bisa masuk lagi nomor akun diganti pedahal tidak pernah menerima kode otp apapun,11 bulan yang lalu,youtube,netral,sama kejadian nya kaya tiba logout terus ga bisa masuk lagi nomor akun diganti pedahal tidak pernah menerima kode otp apapun
​ @febridialugina4173 kok kasus ya sama KA aku ya,8 bulan yang lalu,youtube,netral,​ kok kasus ya sama ka ya
Sama dgn kasus saya sudah 20 hari akun DANA sy tidak bisa login padahal tiap hari terpakai.saldo 2juta cs responya ngaco.,11 bulan yang lalu (diedit),youtube,netral,sama dgn kasus sudah hari akun dana sy tidak bisa login padahal tiap hari terpakaisaldo juta cs responya ngaco
Iya parah si dana sekarang saya ganti nomor udah ga aktif di persulit saldo nyangkut​ @fahrulfahrul7259 ,7 bulan yang lalu,youtube,negatif,iya parah si dana sekarang ganti nomor udah ga aktif persulit saldo nyangkut​
Gopay lebih populer,10 bulan yang lalu,youtube,netral,gopay lebih populer
Applikasi dana punya aku gagal terus verifikasi wajah,10 bulan yang lalu,youtube,negatif,applikasi dana punya gagal terus verifikasi wajah
 @fika_nyrtea_indonesia  Kalo udah masuk dimatiin aja di pengaturan,9 bulan yang lalu,youtube,netral,kalo udah masuk dimatiin aja pengaturan
Tapi Pakek batas waktu,1 tahun yang lalu,youtube,netral,tapi pakek batas waktu
Itu tambahan untuk masa berlaku kartu bukan batas waktu pulsa itu kocak ​ @feryariandy9144 ,10 bulan yang lalu,youtube,netral,tambahan masa berlaku kartu bukan batas waktu pulsa kocak ​
​ @feryariandy9144 terus yg gak pake batas waktu apa ??,7 bulan yang lalu,youtube,netral,​ terus yg gak pake batas waktu apa
"Tapi terlalu banyak main biaya admin, kalo dana aman semua transaksi tanpa biaya admin",1 bulan yang lalu,youtube,positif,tapi terlalu banyak main biaya admin kalo dana aman semua transaksi tanpa biaya admin
Minusnya gopay menghubungi cs susah dan tidak ada live chat,5 hari yang lalu,youtube,netral,minusnya gopay menghubungi cs susah tidak ada live chat
gopay klo nabung sekitar 2 jtan aman ga bang,8 bulan yang lalu,youtube,positif,gopay klo nabung sekitar jtan aman ga bang
"​ @emberbocor-v5v klo sktar 2jt sya msih gk khwatir nympan ny, cma blm prnah nyimpan pling cma 500k aja",8 bulan yang lalu,youtube,netral,​ vv klo sktar jt sya msih gk khwatir nympan ny cma blm prnah nyimpan pling cma k aja
"saya sih makai semuanya ya . Hebat kan tapi ya gitu semuanya juga nggak ada saldonya hix... hix...
 hix... sedih. 😅",1 tahun yang lalu,youtube,netral,sih makai semuanya ya hebat kan tapi ya gitu semuanya nggak ada saldonya hix hix hix sedih 😅
Tapi sering banyak kasus uang hilang di dana. Makanya saya jadi takut nyimpen uang jutaan di dana,1 tahun yang lalu,youtube,negatif,tapi sering banyak kasus uang hilang dana makanya takut nyimpen uang jutaan dana
Dana max saldo ya berapa ya. ??,1 tahun yang lalu,youtube,netral,dana max saldo ya berapa ya
Tapi gk ada lg ovo investasi kak,1 tahun yang lalu,youtube,netral,tapi gk ada lg ovo investasi kak
Shopeepay andalan👍,1 tahun yang lalu,youtube,netral,shopeepay andalan👍
"Aku biasa pakai Bank digital Ally Bank, kalau bank atmku BCA, tapi ayahku kok kartunya blackcard.",1 tahun yang lalu,youtube,netral,biasa pakai bank digital ally bank kalau bank atmku bca tapi ayahku kok kartunya blackcard
kalau untuk nabung jangka panjang di mna min,1 tahun yang lalu,youtube,netral,kalau nabung jangka panjang mna min
linkaja kemana ya,1 tahun yang lalu,youtube,netral,linkaja kemana ya
"Dompet digital internasional dong min, biar bisa kirim saldo ke org dri berbagai negara",1 tahun yang lalu,youtube,netral,dompet digital internasional dong min biar bisa kirim saldo org dri berbagai negara
Udh daftar bnyk dompet digital tp gak ada isi 😂,1 tahun yang lalu,youtube,netral,udh daftar bnyk dompet digital tp gak ada isi 😂
Gopay unggul. Dan gampakn Kyc  Dana Untuk pemula sangat sulit harus foto KTP berkali-kali hadeeeeeh,1 tahun yang lalu,youtube,netral,gopay unggul gampakn kyc dana pemula sangat sulit harus foto ktp berkalikali hadeeeeeh
Ada yg bisa kasi keterangan tentang flip?,1 tahun yang lalu,youtube,netral,ada yg bisa kasi keterangan tentang flip
"Dompet Digital masih DANA sih juaranya❤
Aku udah 10 Tahun pake DANA dan sering dapet Gratis Transaksi 10 Kali, bisa investasi Emas dan yang pasti bisa tarik tunai di Alfamart😊",1 tahun yang lalu (diedit),youtube,netral,dompet digital masih dana sih juaranya❤ udah tahun pake dana sering dapet gratis transaksi kali bisa investasi emas pasti bisa tarik tunai alfamart😊
Dompet digital tidak diawasi OJK,1 tahun yang lalu,youtube,netral,dompet digital tidak diawasi ojk
semoga nanti saldonya luber2 ya kak aminnn,1 tahun yang lalu,youtube,netral,semoga nanti saldonya luber ya kak aminnn
​ @situsgadget itu bukan hebat tapi bloon😅😅😅😅,7 bulan yang lalu,youtube,netral,​ bukan hebat tapi bloon😅😅😅😅
"Gue pengguna dana , topup dgn jumlah maksimum aman aman aja",1 tahun yang lalu,youtube,positif,gue pengguna dana topup dgn jumlah maksimum aman aman aja
" @tantebun  iya tapi yg kena sial kan gatau, soalnya banyak bgt yg duitnya ilang di apk dana. Termasuk temen gw sendiri pernah jadi korbannya",1 tahun yang lalu,youtube,netral,iya tapi yg kena sial kan gatau soalnya banyak bgt yg duitnya ilang apk dana termasuk temen gw sendiri pernah korbannya
 @tantebun  ya kan ga semua,1 tahun yang lalu,youtube,netral,ya kan ga semua
​ @tantebun Gw ilang 450,1 tahun yang lalu,youtube,netral,​ gw ilang
Wallet sekedar untk pembayaran harian sja.  Klo mau simpan banyak di ATM.,1 tahun yang lalu,youtube,netral,wallet sekedar untk pembayaran harian sja klo mau simpan banyak atm
Asal jangan klik link apapun aman,8 bulan yang lalu,youtube,positif,asal jangan klik link apapun aman
aku ilang 2jt di dana,1 tahun yang lalu,youtube,netral,ilang jt dana
